{
  "$schema": "https://json-schema.org/draft/2020-12/schema",
  "title": "worker handoff",
  "type": "object",
  "required": ["outcome", "summary", "intent", "key_changes_made", "key_learnings"],
  "additionalProperties": true,
  "properties": {
    "outcome": {"enum": ["pass", "fail", "parked"]},
    "summary": {"type": "string", "minLength": 1},
    "intent": {"type": "string", "minLength": 1},
    "key_changes_made": {
      "type": "array", "items": {"type": "string", "minLength": 1},
      "description": "Material outcomes, not activities"
    },
    "key_learnings": {
      "type": "array", "items": {"type": "string", "minLength": 1},
      "description": "Surprising only — not captured by prior lessons"
    },
    "spec_ambiguities": {
      "type": "array",
      "items": {
        "oneOf": [
          {"type": "string", "minLength": 1},
          {
            "type": "object",
            "required": ["text"],
            "properties": {
              "text": {"type": "string", "minLength": 1},
              "corpus_covers": {"enum": ["both", "one-reading"]}
            }
          }
        ]
      },
      "description": "H9: spec readings that had to be guessed (test-author especially). On high/critical profiles these park the task for the operator BEFORE implementation spends tokens; advisory on lower profiles. I20: use the object form with corpus_covers='both' ONLY when the authored corpus passes under every reading of that ambiguity — such entries are discharged (advisory on all profiles); a bare string means 'one-reading' (blocks)"
    },
    "files_touched": {"type": "array", "items": {"type": "string"}}
  }
}
